{"$schema":"http://json-schema.org/draft-07/schema#","properties":{"default_template":{"description":"默认模板编号，如 01-B","type":"string"},"grade":{"description":"年级，如 七年级","type":"string"},"knowledge_points":{"items":{"properties":{"curriculum_ref":{"description":"课标/教材出处，如 人教版七上 3.3","type":"string"},"id":{"description":"知识点唯一编号，如 kp001","type":"string"},"key_terms":{"description":"本课关键术语，审核用","items":{"type":"string"},"type":"array"},"segments":{"description":"按讲解顺序分段，每段一段口播","items":{"properties":{"diagrams":{"description":"本段需要的精确配图声明","items":{"properties":{"params":{"type":"object"},"type":{"description":"number_line | coordinate | triangle | bar 等，见 diagrams.py","type":"string"}},"required":["type"],"type":"object"},"type":"array"},"id":{"type":"string"},"illustration_prompt":{"description":"场景插图提示词（gpt-image 用），可选","type":"string"},"intent":{"description":"表达意图，如 claim-method-proof-response，见 references/adaptive-composition.md","type":"string"},"script":{"description":"口播文案（可含 LaTeX/数学符号，math2speech 会转口语）","type":"string"},"style":{"description":"本段 TTS 风格微调，可选","type":"string"}},"required":["id","intent","script"],"type":"object"},"type":"array"},"template":{"description":"可覆盖默认模板","type":"string"},"title":{"description":"知识点标题","type":"string"}},"required":["id","title","segments"],"type":"object"},"type":"array"},"series":{"description":"系列名，如 初中数学七年级上","type":"string"},"subject":{"description":"学科，如 数学","type":"string"},"voice_style":{"description":"TTS 风格描述，如 耐心、语速稍慢、吐字清晰的初中数学老师","type":"string"}},"required":["series","subject","grade","knowledge_points"],"title":"K12 知识点批量输入","type":"object"}