{"default_template":"01-B","grade":"七年级","knowledge_points":[{"curriculum_ref":"人教版七上 3.3","id":"kp001","key_terms":["去分母","最小公倍数","等式性质2","一元一次方程"],"segments":[{"id":"why","intent":"claim","script":"解带分母的一元一次方程，比如 $\\frac{x}{2} + \\frac{x}{3} = 5$，第一步不是通分，而是去分母。目标只有一个：让方程里不再出现分母。","style":"开场，语速稍慢，目标句加重"},{"diagrams":[{"params":{"highlight":2,"steps":["x/2 + x/3 = 5","×6","3x + 2x = 30"]},"type":"equation_steps"}],"id":"method","intent":"claim-method-proof-response","script":"方法是等式两边同乘各分母的最小公倍数。这里分母是 2 和 3，最小公倍数是 6。两边同乘 6，得到 $3x + 2x = 30$，分母消失了。这一步用的是等式性质2：等式两边乘同一个数，等式仍然成立。"},{"id":"pitfall","intent":"decompose-and-consolidate","script":"最容易错的有两处：第一，漏乘。没有分母的项，比如常数项，也要乘 6；第二，分子是多项式时要加括号，比如 $\\frac{x+1}{2}$ 去分母后是 $3(x+1)$，不是 $3x+1$。","style":"提醒语气，稍作停顿"},{"id":"close","intent":"response","script":"记住口诀：找最小公倍数，两边同乘，不漏乘，分子多项加括号。下一讲我们练习含括号的去分母。"}],"template":"01-B","title":"一元一次方程——去分母"}],"series":"初中数学七年级上","subject":"数学","voice_style":"耐心、语速稍慢、吐字清晰的初中数学老师，关键步骤加重语气"}